{
    "to_universal": [
        {
			"function": "new_block",
			"options": "universal_minecraft:cauldron"
		},
		{
			"function": "new_properties",
			"options": {
				"cauldron_liquid": "water"
			}
		},
		{
            "function": "map_properties",
            "options": {
                "block_data": {
                    "0": [
                        {
                            "function": "new_properties",
                            "options": {
                                "level": "0"
                            }
                        }
                    ],
                    "1": [
                        {
                            "function": "new_properties",
                            "options": {
                                "level": "0.5"
                            }
                        }
                    ],
                    "2": [
                        {
                            "function": "new_properties",
                            "options": {
                                "level": "1"
                            }
                        }
                    ],
                    "3": [
                        {
                            "function": "new_properties",
                            "options": {
                                "level": "1.5"
                            }
                        }
                    ],
                    "4": [
                        {
                            "function": "new_properties",
                            "options": {
                                "level": "2"
                            }
                        }
                    ],
                    "5": [
                        {
                            "function": "new_properties",
                            "options": {
                                "level": "2.5"
                            }
                        }
                    ],
                    "6": [
                        {
                            "function": "new_properties",
                            "options": {
                                "level": "3"
                            }
                        }
                    ],
                    "8": [
                        {
                            "function": "new_properties",
                            "options": {
                                "level": "0"
                            }
                        }
                    ],
                    "9": [
                        {
                            "function": "new_properties",
                            "options": {
                                "level": "0.5"
                            }
                        }
                    ],
                    "10": [
                        {
                            "function": "new_properties",
                            "options": {
                                "level": "1"
                            }
                        }
                    ],
                    "11": [
                        {
                            "function": "new_properties",
                            "options": {
                                "level": "1.5"
                            }
                        }
                    ],
                    "12": [
                        {
                            "function": "new_properties",
                            "options": {
                                "level": "2"
                            }
                        }
                    ],
                    "13": [
                        {
                            "function": "new_properties",
                            "options": {
                                "level": "2.5"
                            }
                        }
                    ],
                    "14": [
                        {
                            "function": "new_properties",
                            "options": {
                                "level": "3"
                            }
                        }
                    ]
                }
            }
        }
    ],
    "from_universal": {
        "universal_minecraft:cauldron": [
            {
                "function": "new_block",
                "options": "minecraft:cauldron"
            },
            {
				"function": "map_properties",
				"options": {
					"cauldron_liquid": {
						"water": [
							{
								"function": "new_block",
								"options": "minecraft:cauldron"
							},
                            {
                                "function": "map_properties",
                                "options": {
                                    "level": {
                                        "0": [
                                            {
                                                "function": "new_properties",
                                                "options": {
                                                    "block_data": "0"
                                                }
                                            }
                                        ],
                                        "0.5": [
                                            {
                                                "function": "new_properties",
                                                "options": {
                                                    "block_data": "1"
                                                }
                                            }
                                        ],
                                        "1": [
                                            {
                                                "function": "new_properties",
                                                "options": {
                                                    "block_data": "2"
                                                }
                                            }
                                        ],
                                        "1.5": [
                                            {
                                                "function": "new_properties",
                                                "options": {
                                                    "block_data": "3"
                                                }
                                            }
                                        ],
                                        "2": [
                                            {
                                                "function": "new_properties",
                                                "options": {
                                                    "block_data": "4"
                                                }
                                            }
                                        ],
                                        "2.5": [
                                            {
                                                "function": "new_properties",
                                                "options": {
                                                    "block_data": "5"
                                                }
                                            }
                                        ],
                                        "3": [
                                            {
                                                "function": "new_properties",
                                                "options": {
                                                    "block_data": "6"
                                                }
                                            }
                                        ]
                                    }
                                }
                            }
						]
					}
				}
			}
        ]
    },
    "blockstate_specification": {
        "properties": {
            "level": [
                "0",
                "0.5",
                "1",
                "1.5",
                "2",
                "2.5",
                "3"
            ]
        },
        "defaults": {
            "level": "0"
        }
    },
    "blockstate_to_universal": [
        {
            "function": "new_block",
            "options": "universal_minecraft:cauldron"
        },
        {
            "function": "carry_properties",
            "options": {
                "level": [
                    "0",
                    "0.5",
                    "1",
                    "1.5",
                    "2",
                    "2.5",
                    "3"
                ]
            }
        },
        {
			"function": "new_properties",
			"options": {
				"cauldron_liquid": "water"
			}
		}
    ],
    "blockstate_from_universal": {
        "universal_minecraft:cauldron": [
            {
                "function": "new_block",
                "options": "minecraft:cauldron"
            },
            {
                "function": "carry_properties",
                "options": {
                    "level": [
                        "0",
                        "0.5",
                        "1",
                        "1.5",
                        "2",
                        "2.5",
                        "3"
                    ]
                }
            },
            {
				"function": "map_properties",
				"options": {
					"cauldron_liquid": {}
				}
			}
        ]
    }
}
