{
	"to_universal": [
		{
			"function": "map_properties",
			"options": {
				"block_data": {
					"0": [
						{
							"function": "new_block",
							"options": "universal_minecraft:plant"
						},
						{
							"function": "new_properties",
							"options": {
								"type": "grass"
							}
						}
					],
					"1": [
						{
							"function": "new_block",
							"options": "universal_minecraft:plant"
						},
						{
							"function": "new_properties",
							"options": {
								"type": "grass"
							}
						}
					],
					"2": [
						{
							"function": "new_block",
							"options": "universal_minecraft:plant"
						},
						{
							"function": "new_properties",
							"options": {
								"type": "fern"
							}
						}
					],
					"3": [
						{
							"function": "new_block",
							"options": "universal_minecraft:plant"
						},
						{
							"function": "new_properties",
							"options": {
								"type": "fern"
							}
						}
					]
				}
			}
		}
	],
	"from_universal": {
		"universal_minecraft:plant": [
			{
				"function": "map_properties",
				"options": {
					"type": {
						"grass": [
							{
								"function": "new_block",
								"options": "minecraft:tallgrass"
							},
							{
								"function": "new_properties",
								"options": {
									"block_data": "1"
								}
							}
						],
						"fern": [
							{
								"function": "new_block",
								"options": "minecraft:tallgrass"
							},
							{
								"function": "new_properties",
								"options": {
									"block_data": "2"
								}
							}
						]
					}
				}
			}
		]
	},
	"blockstate_specification": {
		"properties": {
			"type": [
				"grass",
				"fern"
			]
		},
		"defaults": {
			"type": "grass"
		}
	},
	"blockstate_to_universal": [
		{
			"function": "map_properties",
			"options": {
				"type": {
					"grass": [
						{
							"function": "new_block",
							"options": "universal_minecraft:plant"
						},
						{
							"function": "new_properties",
							"options": {
								"type": "grass"
							}
						}
					],
					"fern": [
						{
							"function": "new_block",
							"options": "universal_minecraft:plant"
						},
						{
							"function": "new_properties",
							"options": {
								"type": "fern"
							}
						}
					]
				}
			}
		}
	],
	"blockstate_from_universal": {
		"universal_minecraft:plant": [
			{
				"function": "map_properties",
				"options": {
					"type": {
						"grass": [
							{
								"function": "new_block",
								"options": "minecraft:tallgrass"
							},
							{
								"function": "new_properties",
								"options": {
									"type": "grass"
								}
							}
						],
						"fern": [
							{
								"function": "new_block",
								"options": "minecraft:tallgrass"
							},
							{
								"function": "new_properties",
								"options": {
									"type": "fern"
								}
							}
						]
					}
				}
			}
		]
	}
}