{
	"to_universal": [
		{
			"function": "map_properties",
			"options": {
				"block_data": {
					"0": [
						{
							"function": "new_block",
							"options": "universal_minecraft:redstone_ore"
						},
						{
							"function": "new_properties",
							"options": {
								"lit": "\"false\""
							}
						}
					]
				}
			}
		}
	],
	"from_universal": {
		"universal_minecraft:redstone_ore": [
			{
				"function": "map_properties",
				"options": {
					"lit": {
						"\"false\"": [
							{
								"function": "new_block",
								"options": "minecraft:redstone_ore"
							},
							{
								"function": "new_properties",
								"options": {
									"block_data": "0"
								}
							}
						]
					}
				}
			}
		]
	},
	"blockstate_to_universal": [
		{
			"function": "new_block",
			"options": "universal_minecraft:redstone_ore"
		},
		{
			"function": "new_properties",
			"options": {
				"lit": "\"false\""
			}
		}
	],
	"blockstate_from_universal": {
		"universal_minecraft:redstone_ore": [
			{
				"function": "map_properties",
				"options": {
					"lit": {
						"\"false\"": [
							{
								"function": "new_block",
								"options": "minecraft:redstone_ore"
							}
						]
					}
				}
			}
		]
	}
}